name,price
A Light in the Attic,￥443.741378
Tipping the Velvet,￥460.627036
Soumission,￥429.427140
Sharp Objects,￥409.884348
Sapiens: A Brief History of Humankind,￥464.827022
The Requiem Red,￥194.142210
The Dirty Little Secrets of Getting Your Dream Job,￥285.770476
"The Coming Woman: A Novel Based on the Life of the Infamous Feminist, Victoria Woodhull",￥153.685202
The Boys in the Boat: Nine Americans and Their Epic Quest for Gold at the 1936 Berlin Olympics,￥193.713640
The Black Maria,￥446.998510
"Starving Hearts (Triangular Trade Trilogy, #1)",￥119.913886
Shakespeare's Sonnets,￥177.085124
Set Me Free,￥149.656644
Scott Pilgrim's Precious Little Life (Scott Pilgrim #1),￥448.198506
Rip it Up and Start Again,￥300.170428
"Our Band Could Be Your Life: Scenes from the American Indie Underground, 1981-1991",￥490.712650
Olio,￥204.685032
Mesaerion: The Best Science Fiction Stories 1800-1849,￥322.198926
Libertarianism for Beginners,￥439.969962
It's Only the Himalayas,￥387.170138
In Her Wake,￥110.056776
How Music Works,￥319.884648
"Foolproof Preserving: A Guide to Small Batch Jams, Jellies, Pickles, Condiments, and More: A Foolproof Guide to Making Small Batch Jams, Jellies, Pickles, Condiments, and More",￥261.599128
Chase Me (Paris Nights #2),￥216.599278
Black Dust,￥295.970442
Birdsong: A Story in Pictures,￥468.341296
America's Cradle of Quarterbacks: Western Pennsylvania's Football Factory from Johnny Unitas to Joe Montana,￥192.856500
Aladdin and His Wonderful Lamp,￥455.398482
Worlds Elsewhere: Journeys Around Shakespeare’s Globe,￥345.427420
Wall and Piece,￥378.684452
The Four Agreements: A Practical Guide to Personal Freedom,￥151.370924
The Five Love Languages: How to Express Heartfelt Commitment to Your Mate,￥266.141970
The Elephant Tree,￥204.170748
The Bear and the Piano,￥316.198946
Sophie's World,￥136.628116
Penny Maybe,￥285.341906
Maude (1883-1993):She Grew Up with the country,￥154.456628
"In a Dark, Dark Wood",￥168.256582
Behind Closed Doors,￥447.598508
You can't bury them all: Poems,￥288.256182
Slow States of Collapse: Poems,￥491.226934
Reasons to Stay Alive,￥226.370674
Private Paris (Private #10),￥408.084354
#HigherSelfie: Wake Up Your Life. Free Your Soul. Find Your Tribe.,￥198.085054
Without Borders (Wanderlove #1),￥386.312998
When We Collided,￥272.313378
"We Love You, Charlie Freeman",￥430.884278
Untitled Collection: Sabbath Poems 2014,￥122.313878
"Unseen City: The Majesty of Pigeons, the Discreet Charm of Snails & Other Wonders of the Urban Wilderness",￥378.684452
Unicorn Tracks,￥160.970892
"Unbound: How Eight Technologies Made Us Human, Transformed Society, and Brought Our World to the Brink",￥218.742128
Tsubasa: WoRLD CHRoNiCLE 2 (Tsubasa WoRLD CHRoNiCLE #2),￥139.542392
Throwing Rocks at the Google Bus: How Growth Became the Enemy of Prosperity,￥266.741968
This One Summer,￥167.056586
Thirst,￥148.028078
The Torch Is Passed: A Harding Family Story,￥163.628026
The Secret of Dreadwillow Carse,￥481.112682
"The Pioneer Woman Cooks: Dinnertime: Comfort Classics, Freezer Food, 16-Minute Meals, and Other Delicious Ways to Solve Supper!",￥483.512674
The Past Never Ends,￥484.284100
The Natural History of Us (The Fine Art of Pretending #2),￥387.598708
The Nameless City (The Nameless City #1),￥327.084624
The Murder That Never Was (Forensic Instincts #5),￥463.798454
The Most Perfect Thing: Inside (and Outside) a Bird's Egg,￥368.227344
"The Mindfulness and Acceptance Workbook for Anxiety: A Guide to Breaking Free from Anxiety, Phobias, and Worry Using Acceptance and Commitment Therapy",￥204.770746
The Life-Changing Magic of Tidying Up: The Japanese Art of Decluttering and Organizing,￥143.742378
"The Inefficiency Assassin: Time Management Tactics for Working Smarter, Not Longer",￥176.485126
The Gutsy Girl: Escapades for Your Life of Epic Adventure,￥318.256082
The Electric Pencil: Drawings from Inside State Hospital No. 3,￥480.512684
The Death of Humanity: and the Case for Life,￥498.084054
"The Bulletproof Diet: Lose up to a Pound a Day, Reclaim Energy and Focus, Upgrade Your Life",￥420.427170
The Art Forger,￥349.370264
The Age of Genius: The Seventeenth Century and the Birth of the Modern Mind,￥169.113722
The Activist's Tao Te Ching: Ancient Advice for a Modern Revolution,￥276.341936
Spark Joy: An Illustrated Master Class on the Art of Organizing and Tidying Up,￥358.541662
Soul Reader,￥339.256012
Security,￥336.427450
"Saga, Volume 6 (Saga (Collected Editions) #6)",￥214.456428
"Saga, Volume 5 (Saga (Collected Editions) #5)",￥437.484256
Reskilling America: Learning to Labor in the Twenty-First Century,￥169.970862
"Rat Queens, Vol. 3: Demons (Rat Queens (Collected Editions) #11-15)",￥431.998560
"Princess Jellyfish 2-in-1 Omnibus, Vol. 01 (Princess Jellyfish 2-in-1 Omnibus #1)",￥116.656754
Princess Between Worlds (Wide-Awake Princess #5),￥114.342476
"Pop Gun War, Volume 1: Gift",￥162.599458
"Political Suicide: Missteps, Peccadilloes, Bad Calls, Backroom Hijinx, Sordid Pasts, Rotten Breaks, and Just Plain Dumb Mistakes in the Annals of American Politics",￥310.970392
Patience,￥87.085424
"Outcast, Vol. 1: A Darkness Surrounds Him (Outcast #1)",￥132.342416
orange: The Complete Collection 1 (orange: The Complete Collection #1),￥414.941474
Online Marketing for Busy Authors: A Step-By-Step Guide,￥397.284390
On a Midnight Clear,￥120.599598
Obsidian (Lux #1),￥127.371004
My Paris Kitchen: Recipes and Stories,￥286.027618
Masks and Shadows,￥483.426960
"Mama Tried: Traditional Italian Cooking for the Screwed, Crude, Vegan, and Tattooed",￥120.171028
"Lumberjanes, Vol. 2: Friendship to the Max (Lumberjanes #5-8)",￥402.084374
"Lumberjanes, Vol. 1: Beware the Kitten Holy (Lumberjanes #1-4)",￥390.941554
Lumberjanes Vol. 3: A Terrible Plan (Lumberjanes #9-12),￥170.742288
"Layered: Baking, Building, and Styling Spectacular Cakes",￥343.798854
Judo: Seven Steps to Black Belt (an Introductory Guide for Beginners),￥461.998460
Join,￥305.741838
In the Country We Love: My Family Divided,￥188.570800
Immunity: How Elie Metchnikoff Changed the Course of Modern Medicine,￥491.655504
"I Hate Fairyland, Vol. 1: Madly Ever After (I Hate Fairyland (Compilations) #1-5)",￥250.027738
I am a Hero Omnibus Volume 1,￥468.255582
How to Be Miserable: 40 Strategies You Already Use,￥394.541542
Her Backup Boyfriend (The Sorensen Family #1),￥291.170458
"Giant Days, Vol. 2 (Giant Days #5-8)",￥189.513654
Forever and Forever: The Courtship of Henry Longfellow and Fanny Appleton,￥254.484866
First and First (Five Boroughs #3),￥136.885258
Fifty Shades Darker (Fifty Shades #2),￥188.227944
Everydata: The Misinformation Hidden in the Little Data You Consume Every Day,￥465.855590
"Don't Be a Jerk: And Other Practical Advice from Dogen, Japan's Greatest Zen Master",￥325.456058
Danganronpa Volume 1,￥445.627086
Crown of Midnight (Throne of Glass #2),￥371.055906
"Codename Baboushka, Volume 1: The Conclave of Death",￥314.741808
Camp Midnight,￥146.399512
Call the Nurse: True Stories of a Country Nurse on a Scottish Isle,￥249.770596
Burning,￥246.942034
Bossypants,￥423.941444
"Bitch Planet, Vol. 1: Extraordinary Machine (Bitch Planet (Collected Editions))",￥325.027488
"Avatar: The Last Airbender: Smoke and Shadow, Part 3 (Smoke and Shadow #3)",￥240.770626
Algorithms to Live By: The Computer Science of Human Decisions,￥264.084834
A World of Flavor: Your Gluten Free Passport,￥368.141630
"A Piece of Sky, a Grain of Rice: A Memoir in Four Meditations",￥486.512664
A Murder in Time,￥142.628096
A Flight of Arrows (The Pathfinders #2),￥475.969842
A Fierce and Subtle Poison,￥241.113482
A Court of Thorns and Roses (A Court of Thorns and Roses #1),￥448.884218
(Un)Qualified: How God Uses Broken People to Do Big Things,￥462.855600
You Are What You Love: The Spiritual Power of Habit,￥187.456518
"William Shakespeare's Star Wars: Verily, A New Hope (William Shakespeare's Star Wars #4)",￥371.141620
Tuesday Nights in 1980,￥180.342256
Tracing Numbers on a Train,￥356.570240
Throne of Glass (Throne of Glass #1),￥300.598998
Thomas Jefferson and the Tripoli Pirates: The Forgotten War That Changed American History,￥511.198296
Thirteen Reasons Why,￥451.884208
The White Cat and the Monk: A Retelling of the Poem “Pangur Bán”,￥497.826912
The Wedding Dress,￥206.742168
The Vacationers,￥361.284510
The Third Wave: An Entrepreneur’s Vision of the Future,￥108.085354
The Stranger,￥149.485216
The Shadow Hero (The Shadow Hero),￥284.056196
The Secret (The Secret #1),￥234.599218
The Regional Office Is Under Attack!,￥440.227104
The Psychopath Test: A Journey Through the Madness Industry,￥308.570400
The Project,￥91.285410
The Power of Now: A Guide to Spiritual Enlightenment,￥373.198756
The Omnivore's Dilemma: A Natural History of Four Meals,￥327.513194
The Nerdy Nummies Cookbook: Sweet Treats for the Geek in All of Us,￥320.056076
The Murder of Roger Ackroyd (Hercule Poirot #4),￥377.998740
The Mistake (Off-Campus #2),￥371.055906
The Matchmaker's Playbook (Wingmen Inc. #1),￥478.712690
The Love and Lemons Cookbook: An Apple-to-Zucchini Celebration of Impromptu Cooking,￥322.284640
The Long Shadow of Small Ghosts: Murder and Memory in an American City,￥94.028258
The Kite Runner,￥358.455948
The House by the Lake,￥316.713230
The Glittering Court (The Glittering Court #1),￥379.541592
The Girl on the Train,￥471.598428
The Genius of Birds,￥147.770936
The Emerald Mystery,￥198.427910
The Cookies & Cups Cookbook: 125+ sweet & savory recipes reminding you to Always Eat Dessert First,￥353.570250
The Bridge to Consciousness: I'm Writing the Bridge Between Science and Our Old and New Beliefs.,￥274.284800
The Artist's Way: A Spiritual Path to Higher Creativity,￥329.913186
The Art of War,￥285.770476
The Argonauts,￥93.685402
The 10% Entrepreneur: Live Your Startup Dream Without Quitting Your Day Job,￥236.142070
Suddenly in Love (Lake Haven #1),￥479.912686
Something More Than This,￥139.199536
Soft Apocalypse,￥223.884968
So You've Been Publicly Shamed,￥104.828222
Shoe Dog: A Memoir by the Creator of NIKE,￥205.627886
"Shobu Samurai, Project Aryoku (#3)",￥249.084884
Secrets and Lace (Fatal Hearts #1),￥173.742278
Scarlett Epstein Hates It Here,￥373.284470
Romero and Juliet: A Tragic Tale of Love and Zombies,￥316.627516
Redeeming Love,￥175.456558
Poses for Artists Volume 1 - Dynamic and Sitting Poses: An Essential Reference for Figure Drawing and the Human Form,￥351.941684
Poems That Make Grown Women Cry,￥121.628166
"Nightingale, Sing",￥328.113192
Night Sky with Exit Wounds,￥351.855970
Mrs. Houdini,￥259.284850
Modern Romance,￥242.227764
Miss Peregrine’s Home for Peculiar Children (Miss Peregrine’s Peculiar Children #1),￥92.228264
Louisa: The Extraordinary Life of Mrs. Adams,￥144.428090
Little Red,￥115.456758
Library of Souls (Miss Peregrine’s Peculiar Children #3),￥416.227184
Large Print Heart of the Pride,￥164.142310
I Had a Nice Time And Other Lies...: How to find love & sh*t like that,￥491.655504
Hollow City (Miss Peregrine’s Peculiar Children #2),￥368.398772
Grumbles,￥189.942224
Full Moon over Noah’s Ark: An Odyssey to Mount Ararat and Beyond,￥423.684302
Frostbite (Vampire Academy #2),￥257.056286
Follow You Home,￥183.085104
First Steps for New Christians (Print Edition),￥248.570600
Finders Keepers (Bill Hodges Trilogy #2),￥458.827042
"Fables, Vol. 1: Legends in Exile (Fables #1)",￥356.741668
Eureka Trivia 6.0,￥467.912726
Drive: The Surprising Truth About What Motivates Us,￥299.570430
Done Rubbed Out (Reightman & Bailey #1),￥323.313208
Doing It Over (Most Likely To #1),￥305.227554
"Deliciously Ella Every Day: Quick and Easy Recipes for Gluten-Free Snacks, Packed Lunches, and Simple Meals",￥361.370224
Dark Notes,￥164.485166
"Daring Greatly: How the Courage to Be Vulnerable Transforms the Way We Live, Love, Parent, and Lead",￥166.542302
Close to You,￥423.941444
Chasing Heaven: What Dying Taught Me About Living,￥323.998920
Big Magic: Creative Living Beyond Fear,￥263.999120
Becoming Wise: An Inquiry into the Mystery and Art of Living,￥235.113502
Beauty Restored (Riley Family Legacy Novellas #3),￥95.228254
Batman: The Long Halloween (Batman),￥312.856100
Batman: The Dark Knight Returns (Batman),￥131.828132
Ayumi's Violin,￥132.685272
Anonymous,￥401.312948
Amy Meets the Saints and Sages,￥158.228044
Amid the Chaos,￥313.541812
Amatus,￥433.198556
Agnostic: A Spirited Manifesto,￥107.228214
Zealot: The Life and Times of Jesus of Nazareth,￥211.713580
You (You #1),￥373.798754
"Wonder Woman: Earth One, Volume One (Wonder Woman: Earth One #1)",￥320.056076
Wild Swans,￥123.085304
Why the Right Went Wrong: Conservatism--From Goldwater to the Tea Party and Beyond,￥451.284210
Whole Lotta Creativity Going On: 60 Fun and Unusual Exercises to Awaken and Strengthen Your Creativity,￥327.427480
What's It Like in Space?: Stories from Astronauts Who've Been There,￥167.999440
"We Are Robin, Vol. 1: The Vigilante Business (We Are Robin #1)",￥461.998460
Walt Disney's Alice in Wonderland,￥111.085344
V for Vendetta (V for Vendetta Complete),￥317.998940
Until Friday Night (The Field Party #1),￥396.941534
"Unbroken: A World War II Story of Survival, Resilience, and Redemption",￥393.855830
Twenty Yawns,￥189.256512
Through the Woods,￥217.542132
This Is Where It Ends,￥232.456368
The Year of Magical Thinking,￥368.913056
The Wright Brothers,￥486.855520
The White Queen (The Cousins' War #1),￥222.084974
The Wedding Pact (The O'Malleys #2),￥279.513354
The Time Keeper,￥238.970632
The Testament of Mary,￥451.455638
The Star-Touched Queen,￥394.455828
The Songs of the Gods,￥381.255872
The Song of Achilles,￥320.570360
The Rosie Project (Don Tillman #1),￥463.198456
The Power of Habit: Why We Do What We Do in Life and Business,￥144.685232
The Marriage of Opposites,￥240.684912
The Lucifer Effect: Understanding How Good People Turn Evil,￥89.142560
The Long Haul (Diary of a Wimpy Kid #9),￥377.741598
The Loney,￥200.570760
The Literature Book (Big Ideas Simply Explained),￥149.399502
The Last Mile (Amos Decker #2),￥464.655594
The Immortal Life of Henrietta Lacks,￥348.598838
The Hidden Oracle (The Trials of Apollo #1),￥447.941364
The Help Yourself Cookbook for Kids: 60 Easy Plant-Based Recipes Kids Can Make to Stay Healthy and Save the Earth,￥246.599178
The Guilty (Will Robie #4),￥118.456748
The First Hostage (J.B. Collins #2),￥221.570690
The Dovekeepers,￥418.112892
The Darkest Lie,￥302.998990
The Bane Chronicles (The Bane Chronicles #1-11),￥383.398722
The Bad-Ass Librarians of Timbuktu: And Their Race to Save the World’s Most Precious Manuscripts,￥135.170978
The 14th Colony (Cotton Malone #11),￥336.341736
That Darkness (Gardiner and Renner #1),￥119.313888
Tastes Like Fear (DI Marnie Rome #3),￥91.628266
Take Me with You,￥387.512994
Swell: A Year of Waves,￥390.684412
Superman Vol. 1: Before Truth (Superman by Gene Luen Yang #1),￥101.913946
Still Life with Bread Crumbs,￥226.370674
Steve Jobs,￥338.570300
Sorting the Beef from the Bull: The Science of Food Fraud Forensics,￥383.484436
Someone Like You (The Harrisons #2),￥452.484206
"So Cute It Hurts!!, Vol. 6 (So Cute It Hurts!! #6)",￥303.684702
Shtum,￥478.626976
See America: A Celebration of Our National Parks & Treasured Sites,￥418.884318
salt.,￥400.970092
Robin War,￥409.884348
"Red Hood/Arsenal, Vol. 1: Open for Business (Red Hood/Arsenal #1)",￥218.399272
Rain Fish,￥202.027898
"Quarter Life Poetry: Poems for the Young, Broke and Hangry",￥436.198546
Pet Sematary,￥90.513984
"Overload: How to Unplug, Unwind, and Unleash Yourself from the Pressure of Stress",￥446.998510
Once Was a Time,￥156.685192
Old School (Diary of a Wimpy Kid #10),￥101.399662
No Dream Is Too High: Life Lessons From a Man Who Walked on the Moon,￥188.142230
"Naruto (3-in-1 Edition), Vol. 14: Includes Vols. 40, 41 & 42 (Naruto: Omnibus #14)",￥329.056046
My Name Is Lucy Barton,￥356.227384
My Mrs. Brown,￥209.827872
My Kind of Crazy,￥345.941704
Mr. Mercedes (Bill Hodges Trilogy #1),￥247.713460
More Than Music (Chasing the Dream #1),￥322.370354
Made to Stick: Why Some Ideas Survive and Others Die,￥332.998890
Luis Paints the World,￥462.427030
Luckiest Girl Alive,￥427.112862
Lowriders to the Center of the Earth (Lowriders in Space #2),￥441.512814
Love Is a Mix Tape (Music #1),￥154.542342
Looking for Lovely: Collecting the Moments that Matter,￥249.770596
"Living Leadership by Insight: A Good Leader Achieves, a Great Leader Builds Monuments",￥402.084374
Let It Out: A Journey Through Journaling,￥229.627806
Lady Midnight (The Dark Artifices #1),￥139.542392
"It's All Easy: Healthy, Delicious Weeknight Meals in under 30 Minutes",￥167.570870
Island of Dragons (Unwanteds #7),￥254.142010
I Know What I'm Doing -- and Other Lies I Tell Myself: Dispatches from a Life Under Construction,￥222.684972
I Am Pilgrim (Pilgrim #1),￥90.856840
"Hyperbole and a Half: Unfortunate Situations, Flawed Coping Mechanisms, Mayhem, and Other Things That Happened",￥126.428150
"Hush, Hush (Hush, Hush #1)",￥403.027228
Hold Your Breath (Search and Rescue #1),￥247.027748
Hamilton: The Revolution,￥503.912606
Greek Mythic History,￥87.685422
God: The Most Unpleasant Character in All Fiction,￥257.399142
Glory over Everything: Beyond The Kitchen House,￥392.912976
Feathers: Displays of Brilliant Plumage,￥420.427170
"Far & Away: Places on the Brink of Change: Seven Continents, Twenty-Five Years",￥129.085284
Every Last Word,￥398.312958
Eligible (The Austen Project #4),￥232.199226
El Deafo,￥493.884068
Eight Hundred Grapes,￥123.342446
"Eaternity: More than 150 Deliciously Easy Vegan Recipes for a Long, Healthy, Satisfied, Joyful Life",￥443.569950
"Eat Fat, Get Thin",￥463.455598
Don't Get Caught,￥474.426990
Doctor Sleep (The Shining #2),￥343.884568
Demigods & Magicians: Percy and Annabeth Meet the Kanes (Percy Jackson & Kane Chronicles Crossover #1-3),￥321.513214
Dear Mr. Knightley,￥96.085394
Daily Fantasy Sports,￥313.541812
Crazy Love: Overwhelmed by a Relentless God,￥409.027208
Cometh the Hour (The Clifton Chronicles #6),￥214.370714
Code Name Verity (Code Name Verity #1),￥189.685082
Clockwork Angel (The Infernal Devices #1),￥378.341596
City of Glass (The Mortal Instruments #3),￥480.169828
City of Fallen Angels (The Mortal Instruments #4),￥96.256822
City of Bones (The Mortal Instruments #1),￥370.970192
City of Ashes (The Mortal Instruments #2),￥405.170078
Cell,￥173.913706
Catching Jordan (Hundred Oaks),￥435.684262
"Carry On, Warrior: Thoughts on Life Unarmed",￥272.999090
Carrie,￥396.255822
Buying In: The Secret Dialogue Between What We Buy and Who We Are,￥323.998920
Brain on Fire: My Month of Madness,￥422.741448
Batman: Europa,￥274.370514
Barefoot Contessa Back to Basics,￥240.084914
Barefoot Contessa at Home: Everyday Recipes You'll Make Over and Over Again,￥433.884268
Balloon Animals,￥145.970942
Art Ops Vol. 1,￥418.284320
Aristotle and Dante Discover the Secrets of the Universe (Aristotle and Dante Discover the Secrets of the Universe #1),￥498.341196
Angels Walking (Angels Walking #1),￥293.141880
Angels & Demons (Robert Langdon #1),￥441.255672
All the Light We Cannot See,￥256.027718
"Adulthood Is a Myth: A ""Sarah's Scribbles"" Collection",￥93.428260
Abstract City,￥483.169818
A Time of Torment (Charlie Parker #14),￥414.427190
A Study in Scarlet (Sherlock Holmes #1),￥143.399522
"A Series of Catastrophes and Miracles: A True Story of Love, Science, and Cancer",￥484.112672
A People's History of the United States,￥349.627406
A Man Called Ove,￥340.456008
A Distant Mirror: The Calamitous 14th Century,￥124.971012
A Brush of Wings (Angels Walking #3),￥475.798414
1491: New Revelations of the Americas Before Columbus,￥186.856520
"The Three Searches, Meaning, and the Story",￥114.256762
Searching for Meaning in Gailana,￥331.970322
Rook,￥324.513204
My Kitchen Year: 136 Recipes That Saved My Life,￥98.828242
13 Hours: The Inside Account of What Really Happened In Benghazi,￥231.942084
Will You Won't You Want Me?,￥118.799604
Tipping Point for Planet Earth: How Close Are We to the Edge?,￥321.856070
The Star-Touched Queen,￥276.856220
The Silent Sister (Riley MacPherson #1),￥396.770106
The Midnight Watch: A Novel of the Titanic and the Californian,￥224.570680
The Lonely City: Adventures in the Art of Being Alone,￥285.084764
The Gray Rhino: How to Recognize and Act on the Obvious Dangers We Ignore,￥506.998310
The Golden Condom: And Other Essays on Love Lost and Found,￥337.970302
The Epidemic (The Program 0.6),￥123.771016
The Dinner Party,￥484.626956
The Diary of a Young Girl,￥513.426860
The Children,￥101.828232
Stars Above (The Lunar Chronicles #4.5),￥411.855770
Snatched: How A Drug Queen Went Undercover for the DEA and Was Kidnapped By Colombian Guerillas,￥181.799394
Raspberry Pi Electronics Projects for the Evil Genius,￥425.741438
Quench Your Own Thirst: Business Lessons Learned Over a Beer or Two,￥369.770196
Psycho: Sanitarium (Psycho #1.5),￥316.884658
Poisonous (Max Revere Novels #3),￥229.713520
One with You (Crossfire #5),￥134.656694
No Love Allowed (Dodge Cove #1),￥468.427010
Murder at the 42nd Street Library (Raymond Ambler #1),￥465.941304
Most Wanted,￥302.398992
"Love, Lies and Spies",￥176.142270
How to Speak Golf: An Illustrated Guide to Links Lingo,￥499.884048
Hide Away (Eve Duncan #20),￥101.485376
Furiously Happy: A Funny Book About Horrible Things,￥355.370244
Everyday Italian: 125 Simple and Delicious Recipes,￥172.285140
Equal Is Unfair: America's Misguided Fight Against Income Inequality,￥487.369804
Eleanor & Park,￥484.369814
Dirty (Dive Bar #1),￥349.970262
Can You Keep a Secret? (Fear Street Relaunch #4),￥416.912896
Boar Island (Anna Pigeon #19),￥509.826872
A Paris Apartment,￥334.370314
"A la Mode: 120 Recipes in 60 Pairings: Pies, Tarts, Cakes, Crisps, and More Topped with Ice Cream, Gelato, Frozen Custard, and More",￥332.313178
Troublemaker: Surviving Hollywood and Scientology,￥414.770046
The Widow,￥233.656364
"The Sleep Revolution: Transforming Your Life, One Night at a Time",￥100.113952
The Improbability of Love,￥509.569730
The Art of Startup Fundraising,￥179.999400
Take Me Home Tonight (Rock Star Romance #3),￥462.684172
Sleeping Giants (Themis Files #1),￥417.770036
"Setting the World on Fire: The Brief, Astonishing Life of St. Catherine of Siena",￥181.285110
Playing with Fire,￥117.513894
Off the Hook (Fishing for Trouble #1),￥408.598638
Mothering Sunday,￥114.342476
"Mother, Can You Not?",￥144.770946
M Train,￥232.970652
Lilac Girls,￥148.113792
Lies and Other Acts of Love,￥386.912996
Lab Girl,￥350.141690
Keep Me Posted,￥175.370844
It Didn't Start with You: How Inherited Family Trauma Shapes Who We Are and How to End the Cycle,￥482.312678
Grey (Fifty Shades #4),￥415.627186
"Exit, Pursued by a Bear",￥440.055676
Daredevils,￥140.056676
Cravings: Recipes for What You Want to Eat,￥175.713700
Born for This: How to Find the Work You Were Meant to Do,￥185.056526
Arena,￥183.085104
Adultery,￥178.970832
A Mother's Reckoning: Living in the Aftermath of Tragedy,￥167.399442
A Gentleman's Position (Society of Gentlemen #3),￥126.428150
11/22/63,￥415.541472
"10% Happier: How I Tamed the Voice in My Head, Reduced Stress Without Losing My Edge, and Found Self-Help That Actually Works",￥210.599298
10-Day Green Smoothie Cleanse: Lose Up to 15 Pounds in 10 Days!,￥426.084294
Without Shame,￥413.741478
Watchmen,￥497.569770
Unlimited Intuition Now,￥504.598318
Underlying Notes,￥101.313948
The Shack,￥240.256342
The New Brand You: Your New Image Makes the Sale for You,￥377.570170
"The Moosewood Cookbook: Recipes from Moosewood Restaurant, Ithaca, New York",￥105.771076
The Flowers Lied,￥142.970952
"The Fabric of the Cosmos: Space, Time, and the Texture of Reality",￥479.226974
The Book of Mormon,￥210.599298
The Art and Science of Low Carbohydrate Living,￥454.112772
The Alien Club,￥466.284160
Suzie Snowflake: One beautiful flake (a self-esteem story),￥469.798434
Nap-a-Roo,￥214.970712
"NaNo What Now? Finding your editing process, revising your NaNoWriMo book and building a writing career through publishing and beyond",￥89.228274
Modern Day Fables,￥406.627216
If I Gave You God's Phone Number....: Searching for Spirituality in America,￥179.227974
"Fruits Basket, Vol. 9 (Fruits Basket #9)",￥290.999030
Dress Your Family in Corduroy and Denim,￥374.398752
Don't Forget Steven,￥284.827622
Chernobyl 01:23:40: The Incredible True Story of the World's Worst Nuclear Disaster,￥307.884688
Art and Fear: Observations on the Perils (and Rewards) of Artmaking,￥416.827182
A Shard of Ice (The Black Symphony Saga #1),￥485.398382
A Hero's Curse (The Unseen Chronicles #1),￥432.769986
23 Degrees South: A Tropical Tale of Changing Whether...,￥306.770406
"Zero to One: Notes on Startups, or How to Build the Future",￥291.941884
Why Not Me?,￥152.228064
When Breath Becomes Air,￥337.370304
