name,price
Vagabonding: An Uncommon Guide to the Art of Long-Term World Travel,￥316.627516
The Unlikely Pilgrimage of Harold Fry (Harold Fry #1),￥373.884468
The New Drawing on the Right Side of the Brain,￥368.741628
"The Midnight Assassin: Panic, Scandal, and the Hunt for America's First Serial Killer",￥243.856330
The Martian (The Martian #1),￥354.770246
The High Mountains of Portugal,￥438.427110
The Grownup,￥307.541832
The E-Myth Revisited: Why Most Small Businesses Don't Work and What to Do About It,￥316.370374
South of Sunshine,￥247.970602
Smarter Faster Better: The Secrets of Being Productive in Life and Business,￥333.341746
Silence in the Dark (Logan Point #4),￥499.969762
Shadows of the Past (Logan Point #1),￥340.027438
Roller Girl,￥120.856740
Rising Strong,￥187.027948
Proofs of God: Classical Arguments from Tertullian to Barth,￥464.655594
Please Kill Me: The Uncensored Oral History of Punk,￥267.341966
Out of Print: City Lights Spotlight No. 14,￥459.769896
My Life Next Door (My Life Next Door ),￥311.913246
Miller's Valley,￥501.769756
Man's Search for Meaning,￥252.684872
"Love That Boy: What Two Presidents, Eight Road Trips, and My Son Taught Me About a Parent's Expectations",￥214.799284
Living Forward: A Proven Plan to Stop Drifting and Get the Life You Want,￥107.571070
Les Fleurs du Mal,￥248.913456
Left Behind (Left Behind #1),￥349.027408
Kill 'Em and Leave: Searching for James Brown and the American Soul,￥386.141570
Kierkegaard: A Christian Missionary to Christians,￥403.970082
John Vassos: Industrial Design for Modern Life,￥173.313708
I'll Give You the Sun,￥484.112672
I Will Find You,￥378.941594
Hystopia: A Novel,￥188.227944
Howl and Other Poems,￥346.713130
History of Beauty,￥88.199706
Heaven is for Real: A Little Boy's Astounding Story of His Trip to Heaven and Back,￥453.084204
Future Shock (Future Shock #1),￥476.998410
Ender's Game (The Ender Quintet #1),￥374.055896
Diary of a Citizen Scientist: Chasing Tiger Beetles and Other New Ways of Engaging the World,￥243.513474
Death by Leisure: A Cautionary Tale,￥321.513214
Brilliant Beacons: A History of the American Lighthouse,￥98.142530
Brazen: The Courage to Find the You That's Been Hiding,￥164.742308
Between the World and Me,￥487.798374
Being Mortal: Medicine and What Matters in the End,￥471.941284
"A Murder Over a Girl: Justice, Gender, Junior High",￥113.142480
32 Yolks,￥459.684182
"""Most Blessed of the Patriarchs"": Thomas Jefferson and the Empire of the Imagination",￥381.255872
You Are a Badass: How to Stop Doubting Your Greatness and Start Living an Awesome Life,￥103.542512
Wildlife of New York: A Five-Borough Coloring Book,￥189.770796
What Happened on Beale Street (Secrets of the South Mysteries #2),￥217.456418
Unreasonable Hope: Finding Faith in the God Who Brings Purpose to Your Pain,￥397.112962
Under the Tuscan Sun,￥319.970362
Toddlers Are A**holes: It's Not Your Fault,￥218.999270
The Year of Living Biblically: One Man's Humble Quest to Follow the Bible as Literally as Possible,￥297.599008
The Whale,￥308.227544
The Story of Art,￥352.627396
The Origin of Species,￥85.799714
The Great Gatsby,￥308.998970
The Good Girl,￥420.255742
The Glass Castle,￥139.199536
The Faith of Christopher Hitchens: The Restless Soul of the World's Most Notorious Atheist,￥338.998870
The Drowning Girls,￥305.741838
The Constant Princess (The Tudor Court #1),￥142.456668
The Bourne Identity (Jason Bourne #1),￥366.684492
The Bachelor Girl's Guide to Murder (Herringford and Watts Mysteries #1),￥448.284220
The Art Book,￥277.199076
The 7 Habits of Highly Effective People: Powerful Lessons in Personal Change,￥284.313338
Team of Rivals: The Political Genius of Abraham Lincoln,￥172.456568
Steal Like an Artist: 10 Things Nobody Told You About Being Creative,￥179.142260
"Sit, Stay, Love",￥179.142260
Sister Dear,￥344.570280
"Shrunken Treasures: Literary Classics, Short, Sweet, and Silly",￥453.169918
"Rich Dad, Poor Dad",￥443.484236
Raymie Nightingale,￥294.941874
Playing from the Heart,￥277.541932
Nightstruck: A Novel,￥431.569990
"Naturally Lean: 125 Nourishing Gluten-Free, Plant-Based Recipes--All Under 300 Calories",￥97.542532
Meternity,￥373.541612
Memoirs of a Geisha,￥425.741438
Like Never Before (Walker Family #2),￥246.599178
Life of Pi,￥113.313908
Leave This Song Behind: Teen Poetry at Its Best,￥438.598538
King's Folly (The Kinsman Chronicles #1),￥339.513154
John Adams,￥492.255502
How to Cook Everything Vegetarian: Simple Meatless Recipes for Great Food (How to Cook Everything),￥394.370114
How to Be a Domestic Goddess: Baking and the Art of Comfort Cooking,￥242.142050
Good in Bed (Cannie Shapiro #1),￥317.570370
"Fruits Basket, Vol. 7 (Fruits Basket #7)",￥167.742298
For the Love: Fighting for Grace in a World of Impossible Standards,￥386.827282
Finding God in the Ruins: How God Redeems Pain,￥399.770096
Every Heart a Doorway (Every Heart A Doorway #1),￥104.228224
Delivering the Truth (Quaker Midwife Mystery #1),￥179.056546
Counted With the Stars (Out from Egypt #1),￥154.028058
"Chronicles, Vol. 1",￥450.855640
Blue Like Jazz: Nonreligious Thoughts on Christian Spirituality,￥220.884978
Benjamin Franklin: An American Life,￥413.055766
"At The Existentialist Café: Freedom, Being, and apricot cocktails with: Jean-Paul Sartre, Simone de Beauvoir, Albert Camus, Martin Heidegger, Edmund Husserl, Karl Jaspers, Maurice Merleau-Ponty and others",￥256.542002
A Summer In Europe,￥380.055876
A Short History of Nearly Everything,￥449.141360
A Gathering of Shadows (Shades of Magic #2),￥384.084434
The Sound Of Love,￥495.769776
The Rise and Fall of the Third Reich: A History of Nazi Germany,￥340.027438
The Perks of Being a Wallflower,￥471.598428
The Mysterious Affair at Styles (Hercule Poirot #1),￥212.570720
The Man Who Mistook His Wife for a Hat and Other Clinical Tales,￥509.569730
The Makings of a Fatherless Child,￥270.684812
The Joy of Cooking,￥370.884478
The Invention of Wings,￥320.056076
The Hobbit (Middle-Earth Universe),￥152.570920
The Great Railway Bazaar,￥261.770556
The Golden Compass (His Dark Materials #1),￥160.885178
The God Delusion,￥401.570090
The Girl You Left Behind (The Girl You Left Behind #1),￥135.342406
The Fellowship of the Ring (The Lord of the Rings #1),￥88.028278
The Collected Poems of W.B. Yeats (The Collected Works of W.B. Yeats #1),￥132.170988
The Barefoot Contessa Cookbook,￥513.598288
Tell the Wolves I'm Home,￥436.798544
Ship Leaves Harbor: Essays on Travel by a Recovering Journeyman,￥262.284840
Pride and Prejudice,￥165.170878
Musicophilia: Tales of Music and the Brain,￥399.255812
Mere Christianity,￥415.798614
Me Before You (Me Before You #1),￥163.028028
In the Woods (Dublin Murder Squad #1),￥328.970332
In Cold Blood,￥428.398572
How to Stop Worrying and Start Living,￥398.484386
Give It Back,￥157.028048
"Girl, Interrupted",￥361.198796
Fun Home: A Family Tragicomic,￥485.055526
"Fruits Basket, Vol. 6 (Fruits Basket #6)",￥179.656544
Deception Point,￥345.598848
"Death Note, Vol. 6: Give-and-Take (Death Note #6)",￥311.913246
Catherine the Great: Portrait of a Woman,￥501.855470
Better Homes and Gardens New Cook Book,￥339.513154
An Unquiet Mind: A Memoir of Moods and Madness,￥182.570820
A Year in Provence (Provence #1),￥487.541232
World Without End (The Pillars of the Earth #2),￥282.599058
"Will Grayson, Will Grayson (Will Grayson, Will Grayson)",￥405.512934
Why Save the Bankers?: And Other Essays on Our Economic and Political Crisis,￥417.170038
Where She Went (If I Stay #2),￥357.684522
What If?: Serious Scientific Answers to Absurd Hypothetical Questions,￥460.112752
Two Summers,￥125.485296
This Is Your Brain on Music: The Science of a Human Obsession,￥329.141760
The Secret Garden,￥129.256712
The Raven King (The Raven Cycle #4),￥262.027698
The Raven Boys (The Raven Cycle #1),￥494.912636
The Power Greens Cookbook: 140 Delicious Superfood Recipes,￥94.713970
The Metamorphosis,￥244.970612
The Mathews Men: Seven Brothers and the War Against Hitler's U-boats,￥367.798774
The Little Paris Bookshop,￥211.970722
The Hiding Place,￥479.226974
The Grand Design,￥117.942464
The Firm,￥390.512984
The Fault in Our Stars,￥404.741508
The False Prince (The Ascendance Trilogy #1),￥479.998400
The Expatriates,￥382.113012
The Dream Thieves (The Raven Cycle #2),￥295.713300
The Darkest Corners,￥97.113962
The Crossover,￥332.313178
The 5th Wave (The 5th Wave #1),￥101.399662
Tell the Wind and Fire,￥390.084414
Tell Me Three Things,￥358.370234
Talking to Girls About Duran Duran: One Young Man's Quest for True Love and a Cooler Haircut,￥215.570710
Siddhartha,￥293.313308
Shiver (The Wolves of Mercy Falls #1),￥139.113822
Remember Me?,￥98.399672
Red Dragon (Hannibal Lecter #1),￥200.313618
Peak: Secrets from the New Science of Expertise,￥139.542392
My Mother Was Nuts,￥271.113382
Mexican Today: New and Rediscovered Recipes for Contemporary Kitchens,￥213.513574
Maybe Something Beautiful: How Art Transformed a Neighborhood,￥193.199356
Lola and the Boy Next Door (Anna and the French Kiss #2),￥202.542182
Logan Kade (Fallen Crest High #5.5),￥112.456768
Last One Home (New Beginnings #1),￥514.112572
Killing Floor (Jack Reacher #1),￥269.913386
Kill the Boy Band,￥133.028128
Isla and the Happily Ever After (Anna and the French Kiss #3),￥412.541482
If I Stay (If I Stay #1),￥326.827482
I Know Why the Caged Bird Sings (Maya Angelou's Autobiography #1),￥313.284670
Harry Potter and the Deathly Hallows (Harry Potter #7),￥199.885048
"Fruits Basket, Vol. 5 (Fruits Basket #5)",￥139.970962
Foundation (Foundation (Publication Order) #1),￥277.884788
Fool Me Once,￥145.370944
Find Her (Detective D.D. Warren #8),￥191.742218
Evicted: Poverty and Profit in the American City,￥362.313078
Drama,￥331.713180
Dracula the Un-Dead,￥305.398982
Digital Fortress,￥497.141200
"Death Note, Vol. 5: Whiteout (Death Note #5)",￥449.227074
"Data, A Love Story: How I Gamed Online Dating to Meet My Match",￥277.284790
Critique of Pure Reason,￥177.856550
Booked,￥149.913786
"Blue Lily, Lily Blue (The Raven Cycle #3)",￥292.541882
Approval Junkie: Adventures in Caring Too Much,￥504.084034
An Abundance of Katherines,￥85.714000
America's War for the Greater Middle East: A Military History,￥439.027108
Alight (The Generations Trilogy #2),￥502.198326
A Girl's Guide to Moving On (New Beginnings #2),￥268.284820
A Game of Thrones (A Song of Ice and Fire #1),￥397.884388
A Feast for Crows (A Song of Ice and Fire #4),￥147.513794
A Clash of Kings (A Song of Ice and Fire #2),￥92.485406
Vogue Colors A to Z: A Fashion Coloring Book,￥448.712790
The Shining (The Shining #1),￥238.970632
The Pilgrim's Progress,￥430.798564
The Perfect Play (Play by Play #1),￥514.198286
The Passion of Dolssa,￥242.742048
The Jazz of Physics: The Secret Link Between Music and the Structure of the Universe,￥331.798894
The Hunger Games (The Hunger Games #1),￥255.856290
The Hound of the Baskervilles (Sherlock Holmes #5),￥127.028148
The Gunning of America: Business and the Making of American Gun Culture,￥144.085234
The Geography of Bliss: One Grump's Search for the Happiest Places in the World,￥241.970622
The Demonists (Demonist #1),￥446.655654
"The Demon Prince of Momochi House, Vol. 4 (The Demon Prince of Momochi House #4)",￥238.970632
The Bone Hunters (Lexy Vaughan & Steven Macaulay #2),￥511.798294
The Beast (Black Dagger Brotherhood #14),￥394.970112
Some Women,￥117.685322
Shopaholic Ties the Knot (Shopaholic #3),￥414.770046
Paper and Fire (The Great Library #2),￥423.855730
Outlander (Outlander #1),￥168.599438
"Orchestra of Exiles: The Story of Bronislaw Huberman, the Israel Philharmonic, and the One Thousand Jews He Saved from Nazi Horrors",￥105.942504
No One Here Gets Out Alive,￥171.599428
Night Shift (Night Shift #1-20),￥109.285350
Needful Things,￥407.227214
Mockingjay (The Hunger Games #3),￥175.199416
Misery,￥298.199006
Little Women (Little Women #1),￥240.599198
It,￥214.370714
Harry Potter and the Sorcerer's Stone (Harry Potter #1),￥119.142460
Harry Potter and the Prisoner of Azkaban (Harry Potter #3),￥207.170738
Harry Potter and the Order of the Phoenix (Harry Potter #5),￥271.113382
Harry Potter and the Half-Blood Prince (Harry Potter #6),￥417.855750
Harry Potter and the Chamber of Secrets (Harry Potter #2),￥126.342436
Gone with the Wind,￥278.484786
God Is Not Great: How Religion Poisons Everything,￥238.284920
Girl With a Pearl Earring,￥229.456378
"Fruits Basket, Vol. 4 (Fruits Basket #4)",￥432.341416
Far From True (Promise Falls Trilogy #2),￥299.399002
Dark Lover (Black Dagger Brotherhood #1),￥110.313918
Confessions of a Shopaholic (Shopaholic #1),￥419.484316
Changing the Game (Play by Play #2),￥114.685332
Candide,￥502.541182
Can You Keep a Secret?,￥188.056516
Atlas Shrugged,￥227.827812
Animal Farm,￥490.455508
A Walk to Remember,￥483.684102
A New Earth: Awakening to Your Life's Purpose,￥476.998410
"A History of God: The 4,000-Year Quest of Judaism, Christianity, and Islam",￥236.742068
'Salem's Lot,￥424.798584
Zero History (Blue Ant #3),￥298.027578
Wuthering Heights,￥151.970922
World War Z: An Oral History of the Zombie War,￥186.856520
Wild: From Lost to Found on the Pacific Crest Trail,￥394.455828
"Where'd You Go, Bernadette",￥155.399482
When You Are Engulfed in Flames,￥264.770546
We the People: The Modern-Day Figures Who Have Reshaped and Affirmed the Founding Fathers' Vision of America,￥273.856230
We Are All Completely Beside Ourselves,￥206.056456
Walk the Edge (Thunder Road #2),￥277.370504
Voyager (Outlander #3),￥180.599398
Very Good Lives: The Fringe Benefits of Failure and the Importance of Imagination,￥434.227124
Vegan Vegetarian Omnivore: Dinner for Everyone at the Table,￥117.085324
"Unstuffed: Decluttering Your Home, Mind, and Soul",￥497.912626
Under the Banner of Heaven: A Story of Violent Faith,￥257.142000
Two Boys Kissing,￥280.627636
Twilight (Twilight #1),￥359.398802
Twenties Girl,￥366.855920
"Trespassing Across America: One Man's Epic, Never-Done-Before (and Sort of Illegal) Hike Across the Heartland",￥458.655614
Three-Martini Lunch,￥198.942194
"Thinking, Fast and Slow",￥181.199396
The Wild Robot,￥480.598398
"The Wicked + The Divine, Vol. 3: Commercial Suicide (The Wicked + The Divine)",￥123.513874
The Undomestic Goddess,￥392.141550
The Travelers,￥135.170978
The Tipping Point: How Little Things Can Make a Big Difference,￥85.885428
The Thing About Jellyfish,￥418.027178
The Stand,￥495.941204
The Smitten Kitchen Cookbook,￥202.199326
The Silkworm (Cormoran Strike #2),￥197.570770
"The Sandman, Vol. 3: Dream Country (The Sandman (volumes) #3)",￥476.141270
The Rose & the Dagger (The Wrath and the Dawn #2),￥502.626896
The Road to Little Dribbling: Adventures of an American in Britain (Notes From a Small Island #2),￥198.942194
The Rise of Theodore Roosevelt (Theodore Roosevelt #1),￥364.884498
The Restaurant at the End of the Universe (Hitchhiker's Guide to the Galaxy #2),￥93.599688
The Rest Is Noise: Listening to the Twentieth Century,￥298.027578
The Red Tent,￥305.656124
The Purpose Driven Life: What on Earth Am I Here for?,￥318.770366
The Purest Hook (Second Circle Tattoos #3),￥104.999650
The Picture of Dorian Gray,￥254.570580
The Paris Wife,￥315.427520
The Obsession,￥389.398702
The Nightingale,￥225.084964
The New Guy (and Other Senior Year Distractions),￥385.027288
The Nanny Diaries (Nanny #1),￥450.255642
The Name of God is Mercy,￥319.284650
The Maze Runner (The Maze Runner #1),￥179.399402
The Lover's Dictionary,￥497.912626
The Lonely Ones,￥373.627326
The Lean Startup: How Today's Entrepreneurs Use Continuous Innovation to Create Radically Successful Businesses,￥290.741888
The Last Painting of Sara de Vos,￥476.141270
"The Land of 10,000 Madonnas",￥254.056296
The Infinities,￥234.942074
The Husband's Secret,￥450.084214
The Hitchhiker's Guide to the Galaxy (Hitchhiker's Guide to the Galaxy #1),￥409.712920
The Guns of August,￥124.628156
The Guernsey Literary and Potato Peel Pie Society,￥424.541442
The Goldfinch,￥373.541612
The Giver (The Giver Quartet #1),￥105.428220
The Girl with All the Gifts,￥424.027158
The Girl Who Played with Fire (Millennium Trilogy #2),￥189.770796
The Girl Who Kicked the Hornet's Nest (Millennium Trilogy #3),￥492.684072
The Exiled,￥372.427330
"The End of Faith: Religion, Terror, and the Future of Reason",￥189.685082
"The Elegant Universe: Superstrings, Hidden Dimensions, and the Quest for the Ultimate Theory",￥111.685342
"The Disappearing Spoon: And Other True Tales of Madness, Love, and the History of the World from the Periodic Table of the Elements",￥491.569790
The Devil Wears Prada (The Devil Wears Prada #1),￥379.627306
The Demon-Haunted World: Science as a Candle in the Dark,￥447.855650
The Day the Crayons Came Home (Crayons),￥225.684962
The Da Vinci Code (Robert Langdon #2),￥196.799344
The Cuckoo's Calling (Cormoran Strike #1),￥164.656594
The Complete Stories and Poems (The Works of Edgar Allan Poe [Cameo Edition]),￥229.542092
The Complete Poems,￥354.170248
The Catcher in the Rye,￥210.427870
The Cat in the Hat (Beginner Books B-1),￥139.370964
The Case for Christ (Cases for Christianity),￥410.055776
The Book Thief,￥458.484186
The Book of Basketball: The NBA According to The Sports Guy,￥384.341576
The Blind Side: Evolution of a Game,￥460.369894
The Autobiography of Malcolm X,￥200.827902
"The Art of Simple Food: Notes, Lessons, and Recipes from a Delicious Revolution",￥294.170448
The Art of Fielding,￥189.427940
"Surely You're Joking, Mr. Feynman!: Adventures of a Curious Character",￥221.399262
Stiff: The Curious Lives of Human Cadavers,￥314.913236
Spilled Milk: Based on a True Story,￥424.370014
Something Borrowed (Darcy & Rachel #1),￥419.655744
Something Blue (Darcy & Rachel #2),￥468.169868
Soldier (Talon #3),￥211.885008
Shopaholic & Baby (Shopaholic #5),￥398.141530
Seven Days in the Art World,￥448.541362
Seven Brief Lessons on Physics,￥262.284840
Scarlet (The Lunar Chronicles #2),￥124.885298
Sarah's Key,￥396.770106
"Saga, Volume 3 (Saga (Collected Editions) #3)",￥184.885098
Running with Scissors,￥110.656774
Rogue Lawyer (Rogue Lawyer #1),￥429.512854
"Rise of the Rocket Girls: The Women Who Propelled Us, from Missiles to the Moon to Mars",￥357.170238
Rework,￥384.684432
Reservations for Two,￥95.142540
Red: The True Story of Red Riding Hood,￥244.627756
Ready Player One,￥163.456598
Quiet: The Power of Introverts in a World That Can't Stop Talking,￥373.284470
Prodigy: The Graphic Novel (Legend: The Graphic Novel #2),￥373.970182
Persepolis: The Story of a Childhood (Persepolis #1-2),￥335.398882
Packing for Mars: The Curious Science of Life in the Void,￥485.826952
Outliers: The Story of Success,￥121.371024
Original Fake,￥269.570530
Orange Is the New Black,￥210.942154
One for the Money (Stephanie Plum #1),￥281.741918
Notes from a Small Island (Notes From a Small Island #1),￥344.313138
Night (The Night Trilogy #1),￥115.799614
Neither Here nor There: Travels in Europe,￥333.856030
Naked,￥271.627666
Morning Star (Red Rising #3),￥251.999160
"Miracles from Heaven: A Little Girl, Her Journey to Heaven, and Her Amazing Story of Healing",￥495.684062
Midnight Riot (Peter Grant/ Rivers of London - books #1),￥475.369844
Me Talk Pretty One Day,￥493.712640
Manuscript Found in Accra,￥299.827572
Lust & Wonder,￥101.742518
Lila (Gilead #3),￥106.885358
"Life, the Universe and Everything (Hitchhiker's Guide to the Galaxy #3)",￥285.084764
Life Without a Recipe,￥506.055456
Life After Life,￥223.970682
Letter to a Christian Nation,￥190.285080
Let's Pretend This Never Happened: A Mostly True Memoir,￥386.655854
Legend (Legend #1),￥374.484466
"Lean In: Women, Work, and the Will to Lead",￥214.456428
"Lamb: The Gospel According to Biff, Christ's Childhood Pal",￥475.712700
Lady Renegades (Rebel Belle #3),￥454.627056
Jurassic Park (Jurassic Park #1),￥385.455858
It's Never Too Late to Begin Again: Discovering Creativity and Meaning at Midlife and Beyond,￥363.255932
Is Everyone Hanging Out Without Me? (And Other Concerns),￥172.370854
Into the Wild,￥485.998380
Inferno (Robert Langdon #4),￥351.427400
"In the Garden of Beasts: Love, Terror, and an American Family in Hitler's Berlin",￥247.284890
If I Run (If I Run #1),￥428.312858
I've Got Your Number,￥168.770866
I Am Malala: The Girl Who Stood Up for Education and Was Shot by the Taliban,￥247.542032
Hungry Girl Clean & Hungry: Easy All-Natural Recipes for Healthy Eating in the Real World,￥284.056196
"House of Lost Worlds: Dinosaurs, Dynasties, and the Story of Life on Earth",￥374.570180
House of Leaves,￥470.484146
Horrible Bear!,￥321.598928
Holidays on Ice,￥437.741398
Heir to the Sky,￥377.741598
Green Eggs and Ham (Beginner Books B-16),￥92.485406
"Grayson, Vol 3: Nemesis (Grayson #3)",￥366.170208
Gratitude,￥228.513524
Gone Girl,￥322.284640
Golden (Heart of Dread #3),￥361.798794
Girl in the Blue Coat,￥401.398662
"Fruits Basket, Vol. 3 (Fruits Basket #3)",￥387.170138
"Friday Night Lights: A Town, a Team, and a Dream",￥439.027108
Fire Bound (Sea Haven/Sisters of the Heart #5),￥182.399392
Fifty Shades Freed (Fifty Shades #3),￥131.656704
Fellside,￥331.027468
Extreme Prey (Lucas Davenport #26),￥217.713560
Eragon (The Inheritance Cycle #1),￥376.027318
Eclipse (Twilight #3),￥160.628036
Dune (Dune #1),￥470.227004
Dracula,￥451.027068
Do Androids Dream of Electric Sheep? (Blade Runner #1),￥441.255672
Disrupted: My Misadventure in the Start-Up Bubble,￥130.970992
Dead Wake: The Last Crossing of the Lusitania,￥336.341736
"David and Goliath: Underdogs, Misfits, and the Art of Battling Giants",￥152.656634
Darkfever (Fever #1),￥480.169828
Dark Places,￥204.856460
Crazy Rich Asians (Crazy Rich Asians #1),￥421.112882
Counting Thyme,￥91.028268
Cosmos,￥310.027538
Civilization and Its Discontents,￥513.855430
Cinder (The Lunar Chronicles #1),￥223.627826
Catastrophic Happiness: Finding Joy in Childhood's Messy Years,￥320.141790
Career of Evil (Cormoran Strike #3),￥211.885008
Breaking Dawn (Twilight #4),￥302.398992
Brave Enough,￥439.884248
Boy Meets Boy,￥181.027968
"Born to Run: A Hidden Tribe, Superathletes, and the Greatest Race the World Has Never Seen",￥234.427790
Blink: The Power of Thinking Without Thinking,￥186.342236
Black Flags: The Rise of ISIS,￥350.313118
"Black Butler, Vol. 1 (Black Butler #1)",￥422.655734
Big Little Lies,￥189.513654
Between Shades of Gray,￥178.199406
Best of My Love (Fool's Gold #20),￥234.942074
Beowulf,￥328.713190
Beautiful Creatures (Caster Chronicles #1),￥184.713670
Awkward,￥325.884628
Ash,￥189.085084
Are We There Yet?,￥91.371124
Are We Smart Enough to Know How Smart Animals Are?,￥484.969812
Annie on My Mind,￥315.684662
And Then There Were None,￥300.084714
A Walk in the Woods: Rediscovering America on the Appalachian Trail,￥261.256272
A Visit from the Goon Squad,￥120.685312
A Storm of Swords (A Song of Ice and Fire #3),￥267.599108
A Heartbreaking Work of Staggering Genius,￥465.341306
8 Keys to Mental Health Through Exercise,￥266.056256
#GIRLBOSS,￥436.798544
"The Suffragettes (Little Black Classics, #96)",￥101.913946
The Sense of an Ending,￥268.970532
"The Sandman, Vol. 2: The Doll's House (The Sandman (volumes) #2)",￥469.798434
The Course of Love,￥143.828092
Sugar Rush (Offensive Line #2),￥209.313588
"Saga, Volume 2 (Saga (Collected Editions) #2)",￥100.713950
"Run, Spot, Run: The Ethics of Keeping Pets",￥171.599428
New Moon (Twilight #2),￥110.228204
Life,￥270.684812
Kindle Paperwhite User's Guide,￥291.427600
H is for Hawk,￥492.169788
Girl Online On Tour (Girl Online #2),￥458.312758
"Fruits Basket, Vol. 2 (Fruits Basket #2)",￥99.771096
Diary of a Minecraft Zombie Book 1: A Scare of a Dare (An Unofficial Minecraft Book),￥453.255632
"Y: The Last Man, Vol. 1: Unmanned (Y: The Last Man #1)",￥158.656614
While You Were Mine,￥354.170248
Where Lightning Strikes (Bleeding Stars #3),￥340.884578
When I'm Gone,￥445.369944
Ways of Seeing,￥338.656014
"Vampire Knight, Vol. 1 (Vampire Knight #1)",￥131.999560
Vampire Girl (Vampire Girl #1),￥461.312748
Twenty Love Poems and a Song of Despair,￥265.284830
Travels with Charley: In Search of America,￥495.598348
Three Wishes (River of Time: California #1),￥378.684452
This One Moment (Pushing Limits #1),￥417.512894
The Zombie Room,￥168.770866
"The Wicked + The Divine, Vol. 1: The Faust Act (The Wicked + The Divine)",￥313.027528
The Tumor,￥356.227384
The Story of Hong Gildong,￥370.198766
The Silent Wife,￥105.771076
The Silent Twin (Detective Jennifer Knight #3),￥310.713250
The Selfish Gene,￥252.427730
The Secret Healer,￥296.227584
"The Sandman, Vol. 1: Preludes and Nocturnes (The Sandman (volumes) #1)",￥463.884168
The Republic,￥289.541892
The Odyssey,￥254.056296
The No. 1 Ladies' Detective Agency (No. 1 Ladies' Detective Agency #1),￥494.569780
The Nicomachean Ethics,￥311.484676
